<?xml version="1.0" encoding="UTF-8"?>
<page name="PolicySummary" dialog="true" xmlns="http://www.w3schools.com" xmlns:xsi="http://www.w3.org/2001/XMLSchema-instance" xsi:schemaLocation="http://www.w3schools.com screen.xsd">
	<action>com.gui.policy.SummaryAction</action>
	<panel dimension="0,0,1,1,1.0,1.0,12,1,0,0,0,0">
		<property label="Title" type="Label" position="0,0" size="80,25" />
		<property property="treeMap.plan.customer.title" type="Label" position="1,0" size="150,25" />
		<property label="First Name" type="Label" position="0,1" size="80,25" />
		<property property="treeMap.plan.customer.firstName" type="Label" position="1,1" size="150,25" />
		<property label="Last Name" type="Label" position="2,1" size="80,25" />
		<property property="treeMap.plan.customer.lastName" type="Label" position="3,1" size="150,25" />
		<property label="Middle Name" type="Label" position="0,2" size="80,25" />
		<property property="treeMap.plan.customer.middleName" type="Label" position="1,2" size="150,25" />
		<property label="Email" type="Label" position="2,2" size="80,25" />
		<property property="treeMap.plan.customer.email" type="Label" position="3,2" size="150,25" />
	</panel>
	<panel dimension="0,1,1,1,1.0,1.0,18,1,0,0,0,0">
		<property label="Make" type="Label" position="0,0" size="80,25" />
		<property property="treeMap.MakeModel.make" type="Label" position="1,0" size="150,25" />
		<property label="Model" type="Label" position="2,0" size="80,25" />
		<property property="treeMap.MakeModel.model" type="Label" position="3,0" size="150,25" />
		<property label="VIN" type="Label" position="0,1" size="80,25" />
		<property property="treeMap.policyMap.vehicle.vin" type="Label" position="1,1" size="150,25" />
		<property label="Reg No" type="Label" position="2,1" size="80,25" />
		<property property="treeMap.policyMap.vehicle.regNo" type="Label" position="3,1" size="150,25" />
	</panel>
	<panel dimension="0,2,1,1,1.0,1.0,10,1,0,0,0,0">
		<property name="Confirm" type="Button" position="0,0" size="80,25" />
	</panel>
</page>
